{
  "$schema": "https://json-schema.org/draft/2020-12/schema",
  "schema_id": "cutepower.run-artifact/blocking_gaps/v1",
  "required": [
    "schema",
    "artifact_type",
    "session_id",
    "route_id",
    "phase",
    "generated_at",
    "payload"
  ],
  "properties": {
    "schema": { "const": "cutepower.run-artifact/blocking_gaps/v1" },
    "artifact_type": { "const": "blocking_gaps" },
    "session_id": { "type": "string" },
    "route_id": { "type": "string" },
    "phase": { "type": "string" },
    "generated_at": { "type": "string" },
    "payload": { "type": "array" }
  },
  "payload_item_required": [
    "gap_id",
    "gap_type",
    "message"
  ]
}
